{
  "schema_version": "2.0.0",
  "context_id": "ctx_valid_001",
  "intent": "research",
  "scope": "context-broker-docs",
  "source": "browser",
  "actor": "user@example.com",
  "payload": {
    "url": "https://example.com/article",
    "selection": "This paragraph explains time-bounded context.",
    "notes": "Relevant to ALCOA discussion"
  },
  "created_at": "2026-04-05T00:00:00Z",
  "ttl": "365d",
  "expires_at": "2027-04-05T00:00:00Z",
  "permissions": [
    "summarize",
    "compare"
  ]
}
