{
  "schema_version": "2.0.0",
  "context_id": "ctx_expired_001",
  "intent": "debugging",
  "scope": "legacy-service",
  "source": "ide",
  "actor": "user@example.com",
  "payload": {
    "file": "src/service.py",
    "line": 87,
    "error": "Connection timeout"
  },
  "created_at": "2000-01-01T00:00:00Z",
  "ttl": "1h",
  "expires_at": "2000-01-01T01:00:00Z",
  "permissions": [
    "debug"
  ]
}
